<?xml version='1.0' encoding='UTF-8' standalone='no'?>

<library xmlns:xsi="http://www.w3.org/2001/XMLSchema-instance" xsi:noNamespaceSchemaLocation="boeken.xsd">
    <book>
        <name>Embedded Systems - Micro en C</name>
        <isbn>978-9-048-40835-1</isbn>
        <release_date>2011-09-02</release_date>
        <score>6.2</score>
    </book>
    <book>
        <name>TMap NEXT(r) - Sogeti</name>
        <isbn>827-2-122-99192-8</isbn>
        <release_date>2008-08-10</release_date>
        <score>9.8</score>
    </book>
    <book>
        <name>The Hobbit</name>
        <isbn>583-3-121-48410-5</isbn>
        <release_date>2001-11-09</release_date>
        <score>9</score>
    </book>
    <book>
        <name>Hannibal</name>
        <isbn>986-3-161-48410-0</isbn>
        <release_date>2001-07-13</release_date>
        <score>8.3</score>
    </book>
</library>

